[
  {
    "chapter_no": 1,
    "title": "Patterns and Number Sense",
    "key": "sof-imo-patterns-and-number-sense",
    "questions": [
      {
        "id": "c6imoq001",
        "question": "What number comes next: 7, 11, 15, 19, __?",
        "options": [
          "23",
          "21",
          "25",
          "27"
        ],
        "answer": 0,
        "explanation": "The sequence increases by 4 each time.",
        "difficulty": "Easy"
      },
      {
        "id": "c6imoq011",
        "question": "What number comes next: 10, 14, 18, 22, __?",
        "options": [
          "24",
          "28",
          "26",
          "30"
        ],
        "answer": 2,
        "explanation": "The sequence increases by 4 each time.",
        "difficulty": "Easy"
      },
      {
        "id": "c6imoq021",
        "question": "What number comes next: 13, 17, 21, 25, __?",
        "options": [
          "29",
          "27",
          "31",
          "33"
        ],
        "answer": 0,
        "explanation": "The sequence increases by 4 each time.",
        "difficulty": "Easy"
      },
      {
        "id": "c6imoq031",
        "question": "What number comes next: 16, 20, 24, 28, __?",
        "options": [
          "30",
          "34",
          "32",
          "36"
        ],
        "answer": 2,
        "explanation": "The sequence increases by 4 each time.",
        "difficulty": "Easy"
      },
      {
        "id": "c6imoq041",
        "question": "What number comes next: 19, 23, 27, 31, __?",
        "options": [
          "35",
          "33",
          "37",
          "39"
        ],
        "answer": 0,
        "explanation": "The sequence increases by 4 each time.",
        "difficulty": "Easy"
      },
      {
        "id": "c6imoq051",
        "question": "What number comes next: 22, 26, 30, 34, __?",
        "options": [
          "36",
          "40",
          "38",
          "42"
        ],
        "answer": 2,
        "explanation": "The sequence increases by 4 each time.",
        "difficulty": "Easy"
      },
      {
        "id": "c6imoq061",
        "question": "What number comes next: 25, 29, 33, 37, __?",
        "options": [
          "41",
          "39",
          "43",
          "45"
        ],
        "answer": 0,
        "explanation": "The sequence increases by 4 each time.",
        "difficulty": "Easy"
      },
      {
        "id": "c6imoq071",
        "question": "What number comes next: 28, 32, 36, 40, __?",
        "options": [
          "42",
          "46",
          "44",
          "48"
        ],
        "answer": 2,
        "explanation": "The sequence increases by 4 each time.",
        "difficulty": "Easy"
      },
      {
        "id": "c6imoq081",
        "question": "What number comes next: 31, 35, 39, 43, __?",
        "options": [
          "47",
          "45",
          "49",
          "51"
        ],
        "answer": 0,
        "explanation": "The sequence increases by 4 each time.",
        "difficulty": "Easy"
      },
      {
        "id": "c6imoq091",
        "question": "What number comes next: 34, 38, 42, 46, __?",
        "options": [
          "48",
          "52",
          "50",
          "54"
        ],
        "answer": 2,
        "explanation": "The sequence increases by 4 each time.",
        "difficulty": "Easy"
      }
    ]
  },
  {
    "chapter_no": 2,
    "title": "Arithmetic and Operations",
    "key": "sof-imo-arithmetic-and-operations",
    "questions": [
      {
        "id": "c6imoq002",
        "question": "A school collects 24 pencils on Monday and 13 on Tuesday. How many altogether?",
        "options": [
          "32",
          "42",
          "37",
          "11"
        ],
        "answer": 2,
        "explanation": "24 + 13 = 37.",
        "difficulty": "Easy"
      },
      {
        "id": "c6imoq012",
        "question": "A school collects 31 pencils on Monday and 16 on Tuesday. How many altogether?",
        "options": [
          "47",
          "42",
          "52",
          "15"
        ],
        "answer": 0,
        "explanation": "31 + 16 = 47.",
        "difficulty": "Easy"
      },
      {
        "id": "c6imoq022",
        "question": "A school collects 38 pencils on Monday and 19 on Tuesday. How many altogether?",
        "options": [
          "52",
          "62",
          "57",
          "19"
        ],
        "answer": 2,
        "explanation": "38 + 19 = 57.",
        "difficulty": "Easy"
      },
      {
        "id": "c6imoq032",
        "question": "A school collects 45 pencils on Monday and 22 on Tuesday. How many altogether?",
        "options": [
          "67",
          "62",
          "72",
          "23"
        ],
        "answer": 0,
        "explanation": "45 + 22 = 67.",
        "difficulty": "Easy"
      },
      {
        "id": "c6imoq042",
        "question": "A school collects 52 pencils on Monday and 25 on Tuesday. How many altogether?",
        "options": [
          "72",
          "82",
          "77",
          "27"
        ],
        "answer": 2,
        "explanation": "52 + 25 = 77.",
        "difficulty": "Easy"
      },
      {
        "id": "c6imoq052",
        "question": "A school collects 59 pencils on Monday and 28 on Tuesday. How many altogether?",
        "options": [
          "87",
          "82",
          "92",
          "31"
        ],
        "answer": 0,
        "explanation": "59 + 28 = 87.",
        "difficulty": "Easy"
      },
      {
        "id": "c6imoq062",
        "question": "A school collects 66 pencils on Monday and 31 on Tuesday. How many altogether?",
        "options": [
          "92",
          "102",
          "97",
          "35"
        ],
        "answer": 2,
        "explanation": "66 + 31 = 97.",
        "difficulty": "Easy"
      },
      {
        "id": "c6imoq072",
        "question": "A school collects 73 pencils on Monday and 34 on Tuesday. How many altogether?",
        "options": [
          "107",
          "102",
          "112",
          "39"
        ],
        "answer": 0,
        "explanation": "73 + 34 = 107.",
        "difficulty": "Easy"
      },
      {
        "id": "c6imoq082",
        "question": "A school collects 80 pencils on Monday and 37 on Tuesday. How many altogether?",
        "options": [
          "112",
          "122",
          "117",
          "43"
        ],
        "answer": 2,
        "explanation": "80 + 37 = 117.",
        "difficulty": "Easy"
      },
      {
        "id": "c6imoq092",
        "question": "A school collects 87 pencils on Monday and 40 on Tuesday. How many altogether?",
        "options": [
          "127",
          "122",
          "132",
          "47"
        ],
        "answer": 0,
        "explanation": "87 + 40 = 127.",
        "difficulty": "Easy"
      }
    ]
  },
  {
    "chapter_no": 3,
    "title": "Factors and Multiples",
    "key": "sof-imo-factors-and-multiples",
    "questions": [
      {
        "id": "c6imoq003",
        "question": "What is the greatest common factor of 12 and 18?",
        "options": [
          "6",
          "7",
          "5",
          "8"
        ],
        "answer": 0,
        "explanation": "The greatest common factor of 12 and 18 is 6.",
        "difficulty": "Medium"
      },
      {
        "id": "c6imoq013",
        "question": "What is the greatest common factor of 14 and 21?",
        "options": [
          "8",
          "6",
          "7",
          "9"
        ],
        "answer": 2,
        "explanation": "The greatest common factor of 14 and 21 is 7.",
        "difficulty": "Medium"
      },
      {
        "id": "c6imoq023",
        "question": "What is the greatest common factor of 16 and 24?",
        "options": [
          "8",
          "9",
          "7",
          "10"
        ],
        "answer": 0,
        "explanation": "The greatest common factor of 16 and 24 is 8.",
        "difficulty": "Medium"
      },
      {
        "id": "c6imoq033",
        "question": "What is the greatest common factor of 18 and 27?",
        "options": [
          "10",
          "8",
          "9",
          "11"
        ],
        "answer": 2,
        "explanation": "The greatest common factor of 18 and 27 is 9.",
        "difficulty": "Medium"
      },
      {
        "id": "c6imoq043",
        "question": "What is the greatest common factor of 20 and 30?",
        "options": [
          "10",
          "11",
          "9",
          "12"
        ],
        "answer": 0,
        "explanation": "The greatest common factor of 20 and 30 is 10.",
        "difficulty": "Medium"
      },
      {
        "id": "c6imoq053",
        "question": "What is the greatest common factor of 22 and 33?",
        "options": [
          "12",
          "10",
          "11",
          "13"
        ],
        "answer": 2,
        "explanation": "The greatest common factor of 22 and 33 is 11.",
        "difficulty": "Medium"
      },
      {
        "id": "c6imoq063",
        "question": "What is the greatest common factor of 24 and 36?",
        "options": [
          "12",
          "13",
          "11",
          "14"
        ],
        "answer": 0,
        "explanation": "The greatest common factor of 24 and 36 is 12.",
        "difficulty": "Medium"
      },
      {
        "id": "c6imoq073",
        "question": "What is the greatest common factor of 26 and 39?",
        "options": [
          "14",
          "12",
          "13",
          "15"
        ],
        "answer": 2,
        "explanation": "The greatest common factor of 26 and 39 is 13.",
        "difficulty": "Medium"
      },
      {
        "id": "c6imoq083",
        "question": "What is the greatest common factor of 28 and 42?",
        "options": [
          "14",
          "15",
          "13",
          "16"
        ],
        "answer": 0,
        "explanation": "The greatest common factor of 28 and 42 is 14.",
        "difficulty": "Medium"
      },
      {
        "id": "c6imoq093",